Category,Message,cleaned_email
spam,500 new mobiles 2004 must go txt nokia 89545 collect todayfrom 1 www4tcbiz 2optout 08718726270150gbpmtmsg18 txtauction,new mobiles must go txt nokia collect todayfrom wwwtcbiz optout gbpmtmsg txtauction
ham,finally ready fyi,finally ready fyi
ham,auntie huai juan never pick phone,auntie huai juan never pick phone
spam,double mins double txt 12 price linerental latest orange bluetooth mobiles call mobileupd8 latest offers 08000839402 call2optoutlf56,double mins double txt price linerental latest orange bluetooth mobiles call mobileupd latest offers calloptoutlf
ham,ya tel wats ur problem,ya tel wats ur problem
spam,1 nokia tone 4 ur mob every week txt nok 87021 1st tone free get txtin tell ur friends 150ptone 16 reply hl 4info,nokia tone ur mob every week txt nok st tone free get txtin tell ur friends ptone reply hl info
ham,dnt wnt tlk wid u,dnt wnt tlk wid u
ham,spend days waiting ideal path appear front us forget paths made walking waiting goodnight,spend days waiting ideal path appear front us forget paths made walking waiting goodnight
ham,ok arm feeling weak cuz got shot go another time,ok arm feeling weak cuz got shot go another time
ham,please reserve ticket saturday eve chennai thirunelvali tirunelvali chennai sunday evei already see netno ticket availablei want book ticket tackle,please reserve ticket saturday eve chennai thirunelvali tirunelvali chennai sunday evei already see netno ticket availablei want book ticket tackle
ham,storming msg wen u lift phne u say hello u knw wt real meaning hello name girl yes u knw dat girl margaret hello girlfrnd f grahmbell invnted telphone moralone 4get name person bt girlfrnd g n g h,storming msg wen u lift phne u say hello u knw wt real meaning hello name girl yes u knw dat girl margaret hello girlfrnd f grahmbell invnted telphone moralone get name person bt girlfrnd g n g h
ham,thats ok popped ask bout something said youd around tonght wen girl comes,thats ok popped ask bout something said youd around tonght wen girl comes
ham,e best 4 ur exam later,e best ur exam later
ham,hope ur head doesnt hurt 2 much ploughing way pile ironing staying chinky tonight come round like,hope ur head doesnt hurt much ploughing way pile ironing staying chinky tonight come round like
ham,oh ki think wi nz players unsold,oh ki think wi nz players unsold
ham,haha got fast lose weight thk muz go 4 month den got effect geelater go aust put bk e weight,haha got fast lose weight thk muz go month den got effect geelater go aust put bk e weight
ham,wonder got online love gone net cafe get phone recharged friends net think boytoy,wonder got online love gone net cafe get phone recharged friends net think boytoy
ham,haha kidding papa needs drugs,haha kidding papa needs drugs
ham,thk shld b ya wana go 4 lessons haha go one whole stretch,thk shld b ya wana go lessons haha go one whole stretch
ham,oh ok,oh ok
ham,r still meeting 4 dinner tonight,r still meeting dinner tonight
ham,thats cool gentleman treat dignity respect,thats cool gentleman treat dignity respect
ham,shall start hear,shall start hear
ham,wait 4 u lor need 2 feel bad lar,wait u lor need feel bad lar
ham,check got detailed message,check got detailed message
ham,registered sinco payee log icicibankcom enter urn ltgt confirm beware frauds share disclose urn anyone,registered sinco payee log icicibankcom enter urn ltgt confirm beware frauds share disclose urn anyone
ham,decided people care stuff vote caring stuff losers,decided people care stuff vote caring stuff losers
ham,kaiez enjoy ur tuition gee thk e second option sounds beta ill go yan jiu den msg u,kaiez enjoy ur tuition gee thk e second option sounds beta ill go yan jiu den msg u
ham,registered sinco payee log icicibankcom enter urn ltgt confirm beware frauds share disclose urn anyone,registered sinco payee log icicibankcom enter urn ltgt confirm beware frauds share disclose urn anyone
ham,cool fun practicing making babies,cool fun practicing making babies
ham,actually getting ready leave house,actually getting ready leave house
ham,kkany special today,kkany special today
spam,urgent important information o2 user today lucky day 2 find log onto httpwwwurawinnercom fantastic surprise awaiting,urgent important information user today lucky day find log onto httpwwwurawinnercom fantastic surprise awaiting
ham,got ta,got ta
ham,ive got ten bucks jay noncomittal,ive got ten bucks jay noncomittal
ham,hungry,hungry
ham,pls speak customer machan,pls speak customer machan
ham,somewhere beneath pale moon light someone think u dreams come true goodnite amp sweet dreams,somewhere beneath pale moon light someone think u dreams come true goodnite amp sweet dreams
ham,wen ur lovable bcums angry wid u dnt take seriously coz angry childish n true way showing deep affection care n luv kettoda manda nice day da,wen ur lovable bcums angry wid u dnt take seriously coz angry childish n true way showing deep affection care n luv kettoda manda nice day da
spam,dear uve invited xchat final attempt contact u txt chat 86688 150pmsgrcvdhgsuite3422landsroww1j6hl ldn 18 yrs,dear uve invited xchat final attempt contact u txt chat pmsgrcvdhgsuitelandsrowwjhl ldn yrs
ham,wats ur opinion abt abt character,wats ur opinion abt abt character
ham,jay snickering tells x totally fucking chords speak,jay snickering tells x totally fucking chords speak
ham,nofew hours beforewent hair cut,nofew hours beforewent hair cut
ham,wonder cos dun rem seeing silver car thk saw black one,wonder cos dun rem seeing silver car thk saw black one
ham,lmao take pic send,lmao take pic send
ham,speak feel words better silence gud mrng,speak feel words better silence gud mrng
ham,shes currently scotland,shes currently scotland
ham,work week,work week
spam,congratulations ur awarded either 500 cd gift vouchers free entry 2 100 weekly draw txt music 87066 tncs wwwldewcom 1 win150ppmx3age16,congratulations ur awarded either cd gift vouchers free entry weekly draw txt music tncs wwwldewcom winppmxage
ham,lol great im getting hungry,lol great im getting hungry
ham,yes saw message,yes saw message
ham,ill mu like ltgt seconds,ill mu like ltgt seconds
ham,ok,ok
ham,thing r good thanx got exams march ive done revision fran still boyf ive got ta interviw 4 exeter bit worriedx,thing r good thanx got exams march ive done revision fran still boyf ive got ta interviw exeter bit worriedx
ham,tell make little spreadsheet track whose idea smoke determine smokes much entire month february ill come,tell make little spreadsheet track whose idea smoke determine smokes much entire month february ill come
spam,sale arsenal dartboard good condition doubles trebles,sale arsenal dartboard good condition doubles trebles
ham,dont look back building coat dont want get sick hurry home wear coat gym,dont look back building coat dont want get sick hurry home wear coat gym
ham,painful personal thought always try keep everybody happy time nobody recognises alone,painful personal thought always try keep everybody happy time nobody recognises alone
ham,thanks lovely wisheds rock,thanks lovely wisheds rock
ham,intrepid duo great time see soon,intrepid duo great time see soon
ham,asked sen come chennai search job,asked sen come chennai search job
ham,dad went oredi,dad went oredi
ham,jus hope true missin cos im really missin havent done anything feel guilty yet,jus hope true missin cos im really missin havent done anything feel guilty yet
ham,wat late still early mah juz go 4 dinner lor aiya dunno,wat late still early mah juz go dinner lor aiya dunno
ham,arms fine hows cardiff uni,arms fine hows cardiff uni
ham,fact leave think addie goes back school tues wed,fact leave think addie goes back school tues wed
ham,cool breeze bright sun fresh flower twittering birds waiting wish u goodmorning amp nice day,cool breeze bright sun fresh flower twittering birds waiting wish u goodmorning amp nice day
ham,yagoing restaurant,yagoing restaurant
ham,ok askd u knw tht,ok askd u knw tht
spam,free 1st week entry 2 textpod 4 chance 2 win 40gb ipod 250 cash every wk txt pod 84128 tscs wwwtextpodnet custcare 08712405020,free st week entry textpod chance win gb ipod cash every wk txt pod tscs wwwtextpodnet custcare
ham,ducking chinchillas,ducking chinchillas
ham,marriage function,marriage function
ham,looks like u wil b getting headstart im leaving bout 230ish u r desperate company could head earlierwe goin meet rummer,looks like u wil b getting headstart im leaving bout ish u r desperate company could head earlierwe goin meet rummer
ham,dont give flying monkeys wot think certainly dont mind friend mine,dont give flying monkeys wot think certainly dont mind friend mine
spam,registered optin subscriber ur draw 4 100 gift voucher entered receipt correct ans 80062 whats no1 bbc charts,registered optin subscriber ur draw gift voucher entered receipt correct ans whats bbc charts
ham,say thanks2,say thanks
ham,msg rajini comes,msg rajini comes
ham,ya ü taking ure practical lessons start june,ya taking ure practical lessons start june
ham,thats good need drugs,thats good need drugs
ham,stupidits possible,stupidits possible
ham,ü decide faster cos sis going home liao,decide faster cos sis going home liao
spam,summers finally fancy chat flirt sexy singles yr area get matched reply summer free 2 join optout txt stop help08714742804,summers finally fancy chat flirt sexy singles yr area get matched reply summer free join optout txt stop help
ham,u sleeping going take haha got spys wat online checking n replying mails lor,u sleeping going take haha got spys wat online checking n replying mails lor
spam,claire havin borin time alone u wan na cum 2nite chat 09099725823 hope 2 c u luv claire xx calls1minmoremobsemspobox45po139wa,claire havin borin time alone u wan na cum nite chat hope c u luv claire xx callsminmoremobsemspoboxpowa
ham,fighting world easy u either win lose bt fightng some1 close u dificult u lose u lose u win u still lose,fighting world easy u either win lose bt fightng close u dificult u lose u lose u win u still lose
spam,bought one ringtone getting texts costing 3 pound offering tones etc,bought one ringtone getting texts costing pound offering tones etc
ham,yalru lyfu astne chikku bt innu mundhe lyf ali halla ke bilo marriageprogram edhae lyf nt yet ovr chikkuali vargu lyfu meow meowd,yalru lyfu astne chikku bt innu mundhe lyf ali halla ke bilo marriageprogram edhae lyf nt yet ovr chikkuali vargu lyfu meow meowd
ham,kinda first one gets twelve aah speak tomo,kinda first one gets twelve aah speak tomo
spam,09066362231 urgent mobile 07xxxxxxxxx 2000 bonus caller prize 020603 2nd attempt reach call 09066362231 asap,urgent mobile xxxxxxxxx bonus caller prize nd attempt reach call asap
ham,ok good later come find ü c lucky told ü go earlier later pple take finish ü,ok good later come find c lucky told go earlier later pple take finish
ham,wat makes u thk ill fall actually thk im quite prone 2 falls lucky dad home ask come n fetch already,wat makes u thk ill fall actually thk im quite prone falls lucky dad home ask come n fetch already
spam,07801543489 guaranteed latests nokia phone 40gb ipod mp3 player 500 prize txt wordcollect no83355 tcllc nyusa 150pmt msgrcvd18,guaranteed latests nokia phone gb ipod mp player prize txt wordcollect tcllc nyusa pmt msgrcvd
ham,account refilled successfully inr ltdecimalgt keralacircle prepaid account balance rs ltdecimalgt transaction id kr ltgt,account refilled successfully inr ltdecimalgt keralacircle prepaid account balance rs ltdecimalgt transaction id kr ltgt
ham,wont touch permission,wont touch permission
spam,hi lucy hubby meetins day fri b alone hotel u fancy cumin pls leave msg 2day 09099726395 lucy x calls1minmobsmorelkpobox177hp51fl,hi lucy hubby meetins day fri b alone hotel u fancy cumin pls leave msg day lucy x callsminmobsmorelkpoboxhpfl
ham,7 wonders world 7th 6th ur style 5th ur smile 4th ur personality 3rd ur nature 2nd ur sms 1st ur lovely friendship good morning dear,wonders world th th ur style th ur smile th ur personality rd ur nature nd ur sms st ur lovely friendship good morning dear
ham,take small dose tablet fever,take small dose tablet fever
ham,oh u must taken real valentine shopping first,oh u must taken real valentine shopping first
ham,sent email address incomm right,sent email address incomm right
ham,gon na blakes night might able get little early,gon na blakes night might able get little early
ham,friendship game play word say doesnt start march ends may tomorrow yesterday today e,friendship game play word say doesnt start march ends may tomorrow yesterday today e
ham,nice waitshould texting right im gon na pay ticket ya know,nice waitshould texting right im gon na pay ticket ya know
ham,im watching lotr w sis dis aft u wan 2 meet 4 dinner nite,im watching lotr w sis dis aft u wan meet dinner nite
ham,keeping away like,keeping away like
ham,think far find check google maps place dorm,think far find check google maps place dorm
ham,trip ok quite tiring lor uni starts today ok 4 cos im taking modules jus concentrating final yr project,trip ok quite tiring lor uni starts today ok cos im taking modules jus concentrating final yr project
ham,always saying welp,always saying welp
ham,im guy browsin compulsory,im guy browsin compulsory
ham,ok,ok
ham,purity friendship two smiling reading forwarded messageits smiling seeing name gud evng musthu,purity friendship two smiling reading forwarded messageits smiling seeing name gud evng musthu
ham,sorry ill call later,sorry ill call later
ham,add dont really care cant least get dude fuck hey money want,add dont really care cant least get dude fuck hey money want
ham,hello lover goes new job happy think wake slave send teasing kiss across sea,hello lover goes new job happy think wake slave send teasing kiss across sea
ham,told number gautham,told number gautham
ham,tell need investigate anywhere,tell need investigate anywhere
ham,ok juz receive,ok juz receive
ham,cant believe said many things morning really wanted say good morning love beautiful morning see library later,cant believe said many things morning really wanted say good morning love beautiful morning see library later
spam,account credited 500 free text messages activate txt word credit 80488 tcs www80488biz,account credited free text messages activate txt word credit tcs wwwbiz
ham,end might still vomit okay everything come,end might still vomit okay everything come
ham,moneyas youmoney aint thinghow sha,moneyas youmoney aint thinghow sha
ham,everything weather keep extra warm cold nothing serious pls lots vitamin c,everything weather keep extra warm cold nothing serious pls lots vitamin c
ham,hey gals anyone u going e driving centre tmr,hey gals anyone u going e driving centre tmr
ham,im always yahoo messenger send message ill get may send mobile mode sha ill get reply,im always yahoo messenger send message ill get may send mobile mode sha ill get reply
ham,im putting ready lttimegt,im putting ready lttimegt
ham,time n smile r two crucial things life sometimes time makes us forget smile sometimes someones smile makes us forget time gud noon,time n smile r two crucial things life sometimes time makes us forget smile sometimes someones smile makes us forget time gud noon
spam,sms ac jsco energy high u may know 2channel 2day ur leadership skills r strong psychic reply ans wquestion end reply end jsco,sms ac jsco energy high u may know channel day ur leadership skills r strong psychic reply ans wquestion end reply end jsco
ham,hostbased idps linux systems,hostbased idps linux systems
spam,hot live fantasies call 08707509020 20p per min ntt ltd po box 1327 croydon cr9 5wb 0870 national rate call,hot live fantasies call p per min ntt ltd po box croydon cr wb national rate call
ham,dawhats plan,dawhats plan
ham,ill ltgt ok,ill ltgt ok
ham,oh god im almost home,oh god im almost home
ham,total video converter free download type google search,total video converter free download type google search
spam,thanks vote sing along stars karaoke mobile free link reply sing,thanks vote sing along stars karaoke mobile free link reply sing
ham,wen ur lovable bcums angry wid u dnt take seriously coz angry childish n true way showing deep affection care n luv kettoda manda nice day da,wen ur lovable bcums angry wid u dnt take seriously coz angry childish n true way showing deep affection care n luv kettoda manda nice day da
ham,sounds like something someone testing would sayy,sounds like something someone testing would sayy
ham,u love someone dont make love u much u love much dont want loved anyone except gud nit,u love someone dont make love u much u love much dont want loved anyone except gud nit
ham,peteis phone still jenny college leannewhat,peteis phone still jenny college leannewhat
ham,oops sorry check dont mind picking tomo half eight station would ok,oops sorry check dont mind picking tomo half eight station would ok
ham,hey sweet wondering moment might come want send file someone wont go yahoo connection sucks remember set page go download format disc could tell know way download big files download stuff directly internet help would great prey teasing kiss,hey sweet wondering moment might come want send file someone wont go yahoo connection sucks remember set page go download format disc could tell know way download big files download stuff directly internet help would great prey teasing kiss
ham,hows champ leaving glasgow,hows champ leaving glasgow
ham,kall bestcongrats,kall bestcongrats
ham,wonder youll get text,wonder youll get text
ham,need come home give good lovin,need come home give good lovin
spam,brand new mobile music service live free music player arrive shortly install phone browse content top artists,brand new mobile music service live free music player arrive shortly install phone browse content top artists
ham,shall ask one thing dont mistake,shall ask one thing dont mistake
ham,check wid corect speling ie sarcasm,check wid corect speling ie sarcasm
spam,urgent mobile awarded 2000 bonus caller prize 10803 2nd attempt contact call 08714719523 box95qu bt national rate,urgent mobile awarded bonus caller prize nd attempt contact call boxqu bt national rate
ham,angry happen dear,angry happen dear
ham,thk u dun haf 2 hint e forum already lor cos told ron n darren going 2 tell shuhui,thk u dun haf hint e forum already lor cos told ron n darren going tell shuhui
ham,yup ok thanx,yup ok thanx
ham,hicts employee,hicts employee
ham,pls pls find aunt nike,pls pls find aunt nike
ham,wow love sooo much know barely stand wonder day goes well love think miss,wow love sooo much know barely stand wonder day goes well love think miss
ham,screaming means shouting,screaming means shouting
ham,hey happen de alright,hey happen de alright
ham,picked receipt something earlier,picked receipt something earlier
ham,think chennai well settled,think chennai well settled
ham,oh dang didnt mean send lol,oh dang didnt mean send lol
ham,unfortunately ive found pick sister airport evening dont think ill going try go one th,unfortunately ive found pick sister airport evening dont think ill going try go one th
ham,horrible bf v hungry,horrible bf v hungry
ham,remember day,remember day
spam,nokia 7250i get win free auction take part send nokia 86021 hgsuite3422lands roww1jhl 16,nokia get win free auction take part send nokia hgsuitelands rowwjhl
ham,hows feel mr real valentine yo valentine even tho u hardly play,hows feel mr real valentine yo valentine even tho u hardly play
ham,sounds good fingers makes difficult type,sounds good fingers makes difficult type
ham,midnight earliest,midnight earliest
ham,youre sure im trying make xavier smoke dont want smoke told smoke much,youre sure im trying make xavier smoke dont want smoke told smoke much
ham,k come nordstrom youre done,k come nordstrom youre done
ham,u konw waht rael friendship im gving yuo exmpel jsut ese tihs msg evrey splleing tihs msg wrnog bt sitll yuo raed wihtuot ayn mitsake goodnight amp nice sleepsweet dreams,u konw waht rael friendship im gving yuo exmpel jsut ese tihs msg evrey splleing tihs msg wrnog bt sitll yuo raed wihtuot ayn mitsake goodnight amp nice sleepsweet dreams
ham,press conference da,press conference da
spam,hello orange 1 months free access games news sport plus 10 free texts 20 photo messages reply yes terms apply wwworangecoukow,hello orange months free access games news sport plus free texts photo messages reply yes terms apply wwworangecoukow
ham,completed degree use joining finance,completed degree use joining finance
ham,good afternoon love job prospects missing lazy bleak hmmm happy filled love,good afternoon love job prospects missing lazy bleak hmmm happy filled love
ham,shant disturb u anymore jia,shant disturb u anymore jia
ham,bishan lar nearer need buy early cos buy got ta park car,bishan lar nearer need buy early cos buy got ta park car
ham,dont know oh,dont know oh
ham,dude sux snake got old raiden got buff,dude sux snake got old raiden got buff
ham,says hi get ass back south tampa preferably kegger,says hi get ass back south tampa preferably kegger
ham,e msg jus u said thanks gift,e msg jus u said thanks gift
ham,u,u
ham,ok dear call chechi,ok dear call chechi
ham,yeah totes u wan na,yeah totes u wan na
ham,ok found dis pierre cardin one looks normal costs 20 sale,ok found dis pierre cardin one looks normal costs sale
ham,good sleep rhythm person establish rhythm body learn use want know,good sleep rhythm person establish rhythm body learn use want know
ham,wat r u,wat r u
ham,message truro hospital ext phone phone side,message truro hospital ext phone phone side
ham,single line big meaning miss anything 4 ur best life dont miss ur best life anything gud nyt,single line big meaning miss anything ur best life dont miss ur best life anything gud nyt
ham,got gas money chance gang want go grand nature adventure,got gas money chance gang want go grand nature adventure
ham,dnt worryuse ice pieces cloth packalso take 2 tablets,dnt worryuse ice pieces cloth packalso take tablets
ham,dude saw parked car sunroof popped sux,dude saw parked car sunroof popped sux
ham,get ready put excellent sub face,get ready put excellent sub face
ham,tmrw im finishing 9 doors,tmrw im finishing doors
ham,ltgt g saw days ago guy wants sell wifi ltgt 3g ltgt thats blanked,ltgt g saw days ago guy wants sell wifi ltgt g ltgt thats blanked
ham,late,late
ham,whatever im pretty pissed,whatever im pretty pissed
ham,today accept dayu accept brother sister lover dear1 best1 clos1 lvblefrnd jstfrnd cutefrnd lifpartnr belovd swtheart bstfrnd rply means enemy,today accept dayu accept brother sister lover dear best clos lvblefrnd jstfrnd cutefrnd lifpartnr belovd swtheart bstfrnd rply means enemy
ham,dont much image class,dont much image class
ham,noi got rumour going buy apartment chennai,noi got rumour going buy apartment chennai
ham,near kalainar tv officethenampet,near kalainar tv officethenampet
spam,ur cashbalance currently 500 pounds maximize ur cashin send go 86688 150pmsg cc 08718720201 hgsuite3422lands roww1j6hl,ur cashbalance currently pounds maximize ur cashin send go pmsg cc hgsuitelands rowwjhl
spam,sms auction brand new nokia 7250 4 auction today auction free 2 join take part txt nokia 86021 hgsuite3422lands roww1j6hl,sms auction brand new nokia auction today auction free join take part txt nokia hgsuitelands rowwjhl
ham,sis catching e show e afternoon im watching w c u wan 2 watch today tmr lor,sis catching e show e afternoon im watching w c u wan watch today tmr lor
ham,sounds gd haha wah u yan jiu fast liao,sounds gd haha wah u yan jiu fast liao
ham,nosy guess idk reacting im freaked,nosy guess idk reacting im freaked
ham,remember hurt days satanic imposter meneed pay priceso itmay destiny keep going u said pray get mind get,remember hurt days satanic imposter meneed pay priceso itmay destiny keep going u said pray get mind get
ham,make girl happy difficult make girls happy u need 1 friend 2 companion 3 lover 4 chef ltgt good listener ltgt organizer ltgt good boyfriend ltgt clean ltgt sympathetic ltgt athletic ltgt warm ltgt courageous ltgt determined ltgt true ltgt dependable ltgt intelligent ltgt psychologist ltgt pest exterminator ltgt psychiatrist ltgt healer ltgt stylist ltgt driver aaniye pudunga venaam,make girl happy difficult make girls happy u need friend companion lover chef ltgt good listener ltgt organizer ltgt good boyfriend ltgt clean ltgt sympathetic ltgt athletic ltgt warm ltgt courageous ltgt determined ltgt true ltgt dependable ltgt intelligent ltgt psychologist ltgt pest exterminator ltgt psychiatrist ltgt healer ltgt stylist ltgt driver aaniye pudunga venaam
ham,princess bet brothas chasing,princess bet brothas chasing
ham,shall book chez jules half eight thats ok,shall book chez jules half eight thats ok
ham,hhahhaahahah rofl wtf nig leonardo room something,hhahhaahahah rofl wtf nig leonardo room something
ham,yep dereks house see sunday lt3,yep dereks house see sunday lt
ham,cool let know kicks around ltgt ill day,cool let know kicks around ltgt ill day
ham,sorry ill call later,sorry ill call later
ham,wondering would okay call uncle john let know things nigeria r ltgt dollars 2years sent know strain plan pay back every dime gives every dime expect anything practical something like,wondering would okay call uncle john let know things nigeria r ltgt dollars years sent know strain plan pay back every dime gives every dime expect anything practical something like
ham,charges transfer charges withdraw anyhow like,charges transfer charges withdraw anyhow like
ham,dont search love let love find u thats called falling love bcoz u dont force u fall u know smeone hold u bslvyl,dont search love let love find u thats called falling love bcoz u dont force u fall u know smeone hold u bslvyl
ham,4 lets go bill millers,lets go bill millers
