Category,Message,cleaned_email
ham,sent lanre fakeyes eckankar details mail box,sent lanre fakeyes eckankar details mail box
ham,dad back ph,dad back ph
spam,specially selected receive 3000 award call 08712402050 lines close cost 10ppm 16 tcs apply ag promo,specially selected receive award call lines close cost ppm tcs apply ag promo
ham,ask say please message,ask say please message
ham,e timing go w u lor,e timing go w u lor
ham,love aathilove u lot,love aathilove u lot
ham,callin say hi take care bruv,callin say hi take care bruv
spam,valued vodafone customer computer picked win 150 prize collect easy call 09061743386,valued vodafone customer computer picked win prize collect easy call
ham,u turn heater heater set ltgt degrees,u turn heater heater set ltgt degrees
ham,thanks message really appreciate sacrifice im sure process direct pay find way back test tomorrow im class wonderful day,thanks message really appreciate sacrifice im sure process direct pay find way back test tomorrow im class wonderful day
ham,thats trouble classes go well youre due dodgey one expecting mine tomo see recovery time place,thats trouble classes go well youre due dodgey one expecting mine tomo see recovery time place
spam,free video camera phones half price line rental 12 mths 500 cross ntwk mins 100 txts call mobileupd8 08001950382 call2optout674,free video camera phones half price line rental mths cross ntwk mins txts call mobileupd calloptout
ham,wot u 2 j,wot u j
ham,night night see tomorrow,night night see tomorrow
ham,roger probably going rem 20,roger probably going rem
ham,u think girl propose u today seing ur bloody funky shit fucking faceasssssholeeee,u think girl propose u today seing ur bloody funky shit fucking faceasssssholeeee
ham,wish u feel alone,wish u feel alone
spam,great new offer double mins double txt best orange tariffs get latest camera phones 4 free call mobileupd8 free 08000839402 2stoptxt tcs,great new offer double mins double txt best orange tariffs get latest camera phones free call mobileupd free stoptxt tcs
ham,reason team budget available last buy unsold players base rate,reason team budget available last buy unsold players base rate
ham,ceri u rebel sweet dreamz little buddy c ya 2moro needs blokes,ceri u rebel sweet dreamz little buddy c ya moro needs blokes
spam,ringtoneking 84484,ringtoneking
ham,huh cant thk oredi many pages,huh cant thk oredi many pages
ham,frens go lor alone wif mum n sis lor,frens go lor alone wif mum n sis lor
ham,nationwide auto centre something like newport road liked,nationwide auto centre something like newport road liked
ham,hey missed tm last night phone charge smiles meeting friend shortly,hey missed tm last night phone charge smiles meeting friend shortly
ham,whatever juliana whatever want,whatever juliana whatever want
ham,friendship game play word say doesnt start march ends may tomorrow yesterday today e,friendship game play word say doesnt start march ends may tomorrow yesterday today e
spam,ringtone club gr8 new polys direct mobile every week,ringtone club gr new polys direct mobile every week
ham,hello sort town already dont rush home eating nachos let know eta,hello sort town already dont rush home eating nachos let know eta
ham,ok lor anyway thk cant get tickets cos like quite late already u wan 2 go look 4 ur frens darren wif,ok lor anyway thk cant get tickets cos like quite late already u wan go look ur frens darren wif
spam,bank granite issues strongbuy explosive pick members 300 nasdaq symbol cdgt 500 per,bank granite issues strongbuy explosive pick members nasdaq symbol cdgt per
ham,way ur home,way ur home
ham,dizzamn aight ill ask suitemates get back,dizzamn aight ill ask suitemates get back
ham,nimbomsons yep phone knows one obviously cos thats real word,nimbomsons yep phone knows one obviously cos thats real word
ham,love cuddle want hold strong arms right,love cuddle want hold strong arms right
ham,r u continent,r u continent
ham,well pay like ltgt yrs difficult,well pay like ltgt yrs difficult
spam,bored housewives chat n date 08717507711 btnational rate 10pmin landlines,bored housewives chat n date btnational rate pmin landlines
spam,tried call reply sms video mobile 750 mins unlimited text free camcorder reply call 08000930705 del thurs,tried call reply sms video mobile mins unlimited text free camcorder reply call del thurs
ham,kkwhen give treat,kkwhen give treat
spam,2nd time tried contact u u 400 prize 2 claim easy call 087104711148 10p per minute btnationalrate,nd time tried contact u u prize claim easy call p per minute btnationalrate
ham,hes gon na worry nothing wont give money use,hes gon na worry nothing wont give money use
ham,get gift year didnt get anything bad,get gift year didnt get anything bad
ham,somewhere beneath pale moon light someone think u dreams come true goodnite amp sweet dreams,somewhere beneath pale moon light someone think u dreams come true goodnite amp sweet dreams
ham,well theres pattern emerging friends telling drive come smoke telling im weed fiendmake smoke muchimpede things see im hesitant,well theres pattern emerging friends telling drive come smoke telling im weed fiendmake smoke muchimpede things see im hesitant
ham,ow u deyi paid 60400thousadi told u would call,ow u deyi paid thousadi told u would call
ham,im fine babes aint 2 much tho saw scary movie yest quite funny want 2mrw afternoon town mall sumthinxx,im fine babes aint much tho saw scary movie yest quite funny want mrw afternoon town mall sumthinxx
ham,im reaching home 5 min,im reaching home min
ham,forgot working today wan na chat things ok drop text youre free bored etc ill ring hope well nose essay xx,forgot working today wan na chat things ok drop text youre free bored etc ill ring hope well nose essay xx
ham,ha must walk everywhere take tram cousin said walk vic market hotel,ha must walk everywhere take tram cousin said walk vic market hotel
spam,wan2 win meetgreet westlife 4 u m8 currently tour 1unbreakable 2untamed 3unkempt text 12 3 83049 cost 50p std text,wan win meetgreet westlife u currently tour unbreakable untamed unkempt text cost p std text
spam,please call customer service representative freephone 0808 145 4742 9am11pm guaranteed 1000 cash 5000 prize,please call customer service representative freephone ampm guaranteed cash prize
ham,discussed mother ah,discussed mother ah
ham,ok,ok
ham,sorry cant text amp drive coherently see twenty,sorry cant text amp drive coherently see twenty
spam,receiving weeks triple echo ringtone shortly enjoy,receiving weeks triple echo ringtone shortly enjoy
ham,place get rooms cheap,place get rooms cheap
ham,eek thats lot time especially since american pie like 8 minutes long cant stop singing,eek thats lot time especially since american pie like minutes long cant stop singing
ham,gran onlyfound afew days agocusoon honi,gran onlyfound afew days agocusoon honi
spam,uve selected stay 1 250 top british hotels nothing holiday valued 350 dial 08712300220 claim national rate call bx526 sw73ss,uve selected stay top british hotels nothing holiday valued dial claim national rate call bx swss
ham,university southern california,university southern california
ham,pick rayan macleran,pick rayan macleran
ham,u gd lor go shopping got stuff u wan 2 watch infernal affairs come lar,u gd lor go shopping got stuff u wan watch infernal affairs come lar
ham,well balls time make calls,well balls time make calls
ham,wat time ü wan today,wat time wan today
ham,ltgt mca conform,ltgt mca conform
ham,oh ok wats ur email,oh ok wats ur email
ham,yes princess going make moan,yes princess going make moan
ham,lol ok didnt remember til last nite,lol ok didnt remember til last nite
ham,anyway many good evenings u,anyway many good evenings u
ham,cool ill text,cool ill text
ham,sorry vikky im watching olave mandara movie kano trishul theatre wit frnds,sorry vikky im watching olave mandara movie kano trishul theatre wit frnds
ham,im happy babe woo hoo party dude,im happy babe woo hoo party dude
ham,taking italian food pretty dress panties,taking italian food pretty dress panties
ham,wot u 2 thout u gon na call txt bak luv k,wot u thout u gon na call txt bak luv k
spam,chosen receive 350 award pls call claim number 09066364311 collect award selected receive valued mobile customer,chosen receive award pls call claim number collect award selected receive valued mobile customer
ham,holding,holding
ham,dont flatter tell man mine two pints carlin ten minutes please,dont flatter tell man mine two pints carlin ten minutes please
ham,hope scared,hope scared
ham,cant pick phone right pls send message,cant pick phone right pls send message
ham,im home n ready,im home n ready
spam,please call customer service representative freephone 0808 145 4742 9am11pm guaranteed 1000 cash 5000 prize,please call customer service representative freephone ampm guaranteed cash prize
ham,time u get,time u get
ham,literally bed like ltgt hours,literally bed like ltgt hours
ham,yes reg ciao,yes reg ciao
ham,mean website yes,mean website yes
spam,win 1000 cash prize prize worth 5000,win cash prize prize worth
spam,thanks ringtone order reference number x49your mobile charged 450 tone arrive please call customer services 09065989182,thanks ringtone order reference number xyour mobile charged tone arrive please call customer services
ham,lol could starve lose pound end day,lol could starve lose pound end day
ham,yeah thats impression got,yeah thats impression got
ham,ok ok take care understand,ok ok take care understand
ham,motivate behind every darkness shining light waiting find behind every best friend always trust love bslvyl,motivate behind every darkness shining light waiting find behind every best friend always trust love bslvyl
ham,ya ok dinner,ya ok dinner
ham,slept timeyou,slept timeyou
ham,dont make ne plans nxt wknd coz wants us come ok,dont make ne plans nxt wknd coz wants us come ok
ham,school starting stay whats weather like food social support system like friends school things important,school starting stay whats weather like food social support system like friends school things important
ham,ha ha nan yalrigu heltiniiyo kothi chikku u shared many things wit meso far didnt told body even uttered word abt u ur trusting much tell others plz nxt time dont use words meok chikkub,ha ha nan yalrigu heltiniiyo kothi chikku u shared many things wit meso far didnt told body even uttered word abt u ur trusting much tell others plz nxt time dont use words meok chikkub
ham,noice text youre,noice text youre
ham,hi di yijue meeting 7 pm esaplanade tonight,hi di yijue meeting pm esaplanade tonight
spam,moby pub quizwin 100 high street prize u know new duchess cornwall txt first name 82277unsub stop 150 008704050406 sp,moby pub quizwin high street prize u know new duchess cornwall txt first name unsub stop sp
spam,weeks savamob member offers accessible call 08709501522 details savamob pobox 139 la3 2wu 150week savamob offers mobile,weeks savamob member offers accessible call details savamob pobox la wu week savamob offers mobile
ham,aight ive set free think could text blakes address occurs im quite sure im thought,aight ive set free think could text blakes address occurs im quite sure im thought
ham,hi dear saw dear happy battery low,hi dear saw dear happy battery low
ham,ages hows abj,ages hows abj
ham,prof passed papers sem congrats student enna kalaachutaarama prof gud mrng,prof passed papers sem congrats student enna kalaachutaarama prof gud mrng
ham,dont kick coco hes,dont kick coco hes
ham,fyi im gon na call sporadically starting like ltgt bc doin shit,fyi im gon na call sporadically starting like ltgt bc doin shit
spam,contacted dating service someone know find call mobile landline 09064017305 pobox75ldns7,contacted dating service someone know find call mobile landline poboxldns
spam,tbspersolvo chasing us since sept for38 definitely paying thanks information ignore kath manchester,tbspersolvo chasing us since sept definitely paying thanks information ignore kath manchester
ham,hope youre much fun without see u tomorrow love jess x,hope youre much fun without see u tomorrow love jess x
ham,ok wont call disturb one know avoiding burden,ok wont call disturb one know avoiding burden
ham,ive reached home n bathe liao u call,ive reached home n bathe liao u call
spam,loans purpose even bad credit tenants welcome call noworriesloanscom 08717111821,loans purpose even bad credit tenants welcome call noworriesloanscom
ham,actual exam harder nbme,actual exam harder nbme
ham,lot sickness thing going round take easy hope u feel better soon lol,lot sickness thing going round take easy hope u feel better soon lol
ham,god picked flower dippeditinadew lovingly touched itwhichturnedinto u gifted tomeandsaidthis friend 4u,god picked flower dippeditinadew lovingly touched itwhichturnedinto u gifted tomeandsaidthis friend u
spam,87077 kick new season 2wks free goals news ur mobile txt ur club name 87077 eg villa 87077,kick new season wks free goals news ur mobile txt ur club name eg villa
ham,hey sathya till dint meet even single time saw situation sathya,hey sathya till dint meet even single time saw situation sathya
ham,gam gone outstanding innings,gam gone outstanding innings
ham,played smash bros ltgt religiously,played smash bros ltgt religiously
ham,sir good morning hope good weekend called let know able raise ltgt dad however said would make rest available mid feb amount still quite short hoping would help good day abiola,sir good morning hope good weekend called let know able raise ltgt dad however said would make rest available mid feb amount still quite short hoping would help good day abiola
ham,hurry home soup done,hurry home soup done
ham,check rooms befor activities,check rooms befor activities
ham,good afternoon love good see words ym get tm smart move slave smiles drink coffee await,good afternoon love good see words ym get tm smart move slave smiles drink coffee await
ham,quite ok bit ex u better go eat smth else ill feel guilty,quite ok bit ex u better go eat smth else ill feel guilty
spam,orange brings ringtones time chart heroes free hit week go ringtones pics wap stop receiving tips reply stop,orange brings ringtones time chart heroes free hit week go ringtones pics wap stop receiving tips reply stop
ham,lem know youre,lem know youre
spam,private 2003 account statement 07973788240 shows 800 unredeemed points call 08715203649 identifier code 40533 expires 311004,private account statement shows unredeemed points call identifier code expires
ham,needs stop going bed make fucking dealing,needs stop going bed make fucking dealing
ham,love brother time talk english grins say hey muhommad penny says hello across sea,love brother time talk english grins say hey muhommad penny says hello across sea
spam,tried call reply sms video mobile 750 mins unlimited text free camcorder reply call 08000930705,tried call reply sms video mobile mins unlimited text free camcorder reply call
ham,hey doc pls want get nice shirt hubby nice fiting ones budget ltgt k help pls load card abi hwkeep posted luv 2 mj,hey doc pls want get nice shirt hubby nice fiting ones budget ltgt k help pls load card abi hwkeep posted luv mj
ham,remain unconvinced isnt elaborate test willpower,remain unconvinced isnt elaborate test willpower
ham,life nothing wen v get everything life everything wen v miss something real value people wil realized absence gud mrng,life nothing wen v get everything life everything wen v miss something real value people wil realized absence gud mrng
ham,miss,miss
ham,aint answerin phone actually pretty reasonable hour im sleepy,aint answerin phone actually pretty reasonable hour im sleepy
ham,hey rite u put 10 evey mnth,hey rite u put evey mnth
ham,going bed prin,going bed prin
ham,think thanks see tomo,think thanks see tomo
ham,u dun drive go 2 sch,u dun drive go sch
ham,home lei,home lei
spam,gsoh good spam ladiesu could b male gigolo 2 join uks fastest growing mens club reply oncall mjzgroup 087143423992stop reply stop msg150rcvd,gsoh good spam ladiesu could b male gigolo join uks fastest growing mens club reply oncall mjzgroup stop reply stop msgrcvd
ham,ok come ur home half hour,ok come ur home half hour
spam,u secret admirer looking 2 make contact ufind rreveal thinks ur specialcall 09058094599,u secret admirer looking make contact ufind rreveal thinks ur specialcall
ham,u hav frnd name ashwini ur college,u hav frnd name ashwini ur college
ham,jus finish lunch way home lor tot u dun wan 2 stay sch today,jus finish lunch way home lor tot u dun wan stay sch today
ham,k 2marrow coming class,k marrow coming class
spam,hot live fantasies call 08707500020 20p per min ntt ltd po box 1327 croydon cr9 5wb 0870 national rate call,hot live fantasies call p per min ntt ltd po box croydon cr wb national rate call
ham,pls send address sir,pls send address sir
ham,want lick pussy,want lick pussy
ham,yo gon na still stock tomorrowtoday im trying get dubsack,yo gon na still stock tomorrowtoday im trying get dubsack
spam,urgent mobile number awarded ukp2000 prize guaranteed call 09061790125 landline claim 3030 valid 12hrs 150ppm,urgent mobile number awarded ukp prize guaranteed call landline claim valid hrs ppm
ham,ill see prolly yeah,ill see prolly yeah
ham,thought could go dinner ill treat seem ok,thought could go dinner ill treat seem ok
ham,stand away doesnt heart ache without dont wonder dont crave,stand away doesnt heart ache without dont wonder dont crave
ham,sorry never hear unless book one kinda jokethet really looking skinny white girls one lineyou much camera something like theyre casting look,sorry never hear unless book one kinda jokethet really looking skinny white girls one lineyou much camera something like theyre casting look
ham,doinghow,doinghow
ham,sure thing big man hockey elections 6 shouldnt go longer hour though,sure thing big man hockey elections shouldnt go longer hour though
ham,watch lor saw swatch one thk quite ok ard 116 need 2nd opinion leh,watch lor saw swatch one thk quite ok ard need nd opinion leh
ham,hiya u like hlday pics looked horrible took mo hows camp amrca thing speak soon serena,hiya u like hlday pics looked horrible took mo hows camp amrca thing speak soon serena
ham,babe goes day miss already love loving kiss hope everything goes well,babe goes day miss already love loving kiss hope everything goes well
ham,yunny im goin late,yunny im goin late
ham,doc prescribed morphine cause pain meds arent enough waiting mom bring med kick fast im gon na try later,doc prescribed morphine cause pain meds arent enough waiting mom bring med kick fast im gon na try later
ham,cool want go kappa meet outside mu,cool want go kappa meet outside mu
ham,hey sexy buns told adore loverboy hope remember thank sister law meatballs grins love babe,hey sexy buns told adore loverboy hope remember thank sister law meatballs grins love babe
ham,may b approve panalambut posts,may b approve panalambut posts
spam,spjanuary male sale hot gay chat cheaper call 08709222922 national rate 15pmin cheap 78pmin peak stop texts call 08712460324 10pmin,spjanuary male sale hot gay chat cheaper call national rate pmin cheap pmin peak stop texts call pmin
ham,sorry ill call later,sorry ill call later
ham,dont thnk wrong calling us,dont thnk wrong calling us
ham,im workin get job,im workin get job
ham,youre done mean,youre done mean
ham,ur luck love someone ur fortune love one loves u miracle love person cant love anyone except u gud nyt,ur luck love someone ur fortune love one loves u miracle love person cant love anyone except u gud nyt
ham,hi baby ive got back work wanting see u allday hope didnt piss u phone today u give call xxx,hi baby ive got back work wanting see u allday hope didnt piss u phone today u give call xxx
spam,freemsg todays day ready im horny live town love sex fun games netcollex ltd 08700621170150p per msg reply stop end,freemsg todays day ready im horny live town love sex fun games netcollex ltd p per msg reply stop end
ham,yahoo boys bring perf legal,yahoo boys bring perf legal
ham,need say anything know outsider,need say anything know outsider
ham,ever one foot,ever one foot
ham,got ltgt,got ltgt
ham,good dont need receiptswell done yes please tell whats number could ring,good dont need receiptswell done yes please tell whats number could ring
ham,ever green quote ever told jerry cartoon person irritates u always one loves u vry much fails express gud nyt,ever green quote ever told jerry cartoon person irritates u always one loves u vry much fails express gud nyt
ham,leave wif lar ü wan carry meh heavy da num 98321561 familiar ü,leave wif lar wan carry meh heavy da num familiar
ham,beautiful truth expression face could seen everyone depression heart could understood loved ones gud ni8,beautiful truth expression face could seen everyone depression heart could understood loved ones gud ni
ham,infact happy new year seeing,infact happy new year seeing
spam,simpsons movie released july 2007 name band died start film agreen day bblue day cred day send b c,simpsons movie released july name band died start film agreen day bblue day cred day send b c
ham,thats shame maybe cld meet hrs tomo,thats shame maybe cld meet hrs tomo
ham,lol would despite cramps like girl,lol would despite cramps like girl
ham,cant wait cornwall hope tonight isnt bad well rock night shite anyway im going kip good night speak soon,cant wait cornwall hope tonight isnt bad well rock night shite anyway im going kip good night speak soon
ham,pls help tell sura im expecting battery hont pls send message download movies thanks,pls help tell sura im expecting battery hont pls send message download movies thanks
spam,please call amanda regard renewing upgrading current tmobile handset free charge offer ends today tel 0845 021 3680 subject ts cs,please call amanda regard renewing upgrading current tmobile handset free charge offer ends today tel subject ts cs
ham,havent found way get another app phone eh go net cafe take job geeee need babe crave see,havent found way get another app phone eh go net cafe take job geeee need babe crave see
ham,work mon thurs sat cant leh booked liao day u free,work mon thurs sat cant leh booked liao day u free
ham,ü comin fetch us oredi,comin fetch us oredi
ham,whats nannys address,whats nannys address
spam,urgent 4 costa del sol holiday 5000 await collection call 09050090044 toclaim sae tc pobox334 stockport sk38xh cost150pm max10mins,urgent costa del sol holiday await collection call toclaim sae tc pobox stockport skxh costpm maxmins
ham,haf u eaten wat time u wan 2 come,haf u eaten wat time u wan come
spam,want new video phone 750 anytime network mins half price line rental free text 3 months reply call 08000930705 free delivery,want new video phone anytime network mins half price line rental free text months reply call free delivery
ham,yo call get chance friend mine wanted ask big order,yo call get chance friend mine wanted ask big order
ham,single single answers fighting plus said broke didnt reply,single single answers fighting plus said broke didnt reply
ham,certainly puts things perspective something like happens,certainly puts things perspective something like happens
ham,got tv 2 watch meh u work today,got tv watch meh u work today
ham,felt sonot conveying reason ese,felt sonot conveying reason ese
spam,mobile 11 months u r entitled update latest colour mobiles camera free call mobile update co free 08002986030,mobile months u r entitled update latest colour mobiles camera free call mobile update co free
ham,hows going got exciting karaoke type activities planned im debating whether play football eve feeling lazy though,hows going got exciting karaoke type activities planned im debating whether play football eve feeling lazy though
ham,told coming wednesday,told coming wednesday
ham,ok called mom instead fun,ok called mom instead fun
spam,dear voucher holder claim weeks offer pc please go httpwwwwtlpcouktext tscs apply,dear voucher holder claim weeks offer pc please go httpwwwwtlpcouktext tscs apply
ham,well im desperate ill call armand,well im desperate ill call armand
ham,work right,work right
spam,congrats nokia 3650 video camera phone call 09066382422 calls cost 150ppm ave call 3mins vary mobiles 16 close 300603 post bcm4284 ldn wc1n3xx,congrats nokia video camera phone call calls cost ppm ave call mins vary mobiles close post bcm ldn wcnxx
ham,havent heard anything hes answering texts im guessing flaked said jb fantastic,havent heard anything hes answering texts im guessing flaked said jb fantastic
ham,mmmmmm love youso much ahmad cant wait year begin every second takes closer side happy new year love,mmmmmm love youso much ahmad cant wait year begin every second takes closer side happy new year love
ham,pls whats full name jokes school cos fees university florida seem actually ltgt k pls holla back,pls whats full name jokes school cos fees university florida seem actually ltgt k pls holla back
ham,sorry ill call later,sorry ill call later
ham,ok said ive got wisdom teeth hidden inside n mayb need 2 remove,ok said ive got wisdom teeth hidden inside n mayb need remove
ham,pls pls drink plenty plenty water,pls pls drink plenty plenty water
ham,hows queen going royal wedding,hows queen going royal wedding
ham,hes lag thats sad part keep touch thanks skype,hes lag thats sad part keep touch thanks skype
ham,ok lor go tog lor,ok lor go tog lor
ham,two teams waiting players,two teams waiting players
ham,ü send copy da report,send copy da report
ham,swhrt u deyhope ur ok tot u 2daylove n misstake care,swhrt u deyhope ur ok tot u daylove n misstake care
ham,ok da already planned wil pick,ok da already planned wil pick
spam,urgent please call 0906346330 abta complimentary 4 spanish holiday 10000 cash await collection sae tcs box 47 po19 2ez 150ppm 18,urgent please call abta complimentary spanish holiday cash await collection sae tcs box po ez ppm
