Category,Message,cleaned_email
ham,open rebtel firefox loads put plus sign user name place show two numbers lower number number pick number pin display okay,open rebtel firefox loads put plus sign user name place show two numbers lower number number pick number pin display okay
ham,picking various points,picking various points
spam,married local women looking discreet action 5 real matches instantly phone text match 69969 msg cost 150p 2 stop txt stop bcmsfwc1n3xx,married local women looking discreet action real matches instantly phone text match msg cost p stop txt stop bcmsfwcnxx
ham,wow v v impressed funs shopping,wow v v impressed funs shopping
ham,way ur home,way ur home
spam,burger king wan na play footy top stadium get 2 burger king 1st sept go large super cocacola walk winner,burger king wan na play footy top stadium get burger king st sept go large super cocacola walk winner
ham,problem talk later,problem talk later
ham,ur sis,ur sis
ham,still customer place,still customer place
spam,come takes little time child afraid dark become teenager wants stay night,come takes little time child afraid dark become teenager wants stay night
ham,dude u knw also teluguthts gudk gud nyt,dude u knw also teluguthts gudk gud nyt
ham,confirm eating esplanade,confirm eating esplanade
ham,send id password,send id password
ham,kind took garage centre part exhaust needs replacing part ordered n taking fixed tomo morning,kind took garage centre part exhaust needs replacing part ordered n taking fixed tomo morning
spam,ur chance win 250 cash every wk txt action 80608 tscs wwwmovietriviatv custcare 08712405022 1x150pwk,ur chance win cash every wk txt action tscs wwwmovietriviatv custcare xpwk
ham,well might come,well might come
ham,long quit get like 5 minutes day,long quit get like minutes day
ham,likely called mittelschmertz google dont paracetamol dont worry go,likely called mittelschmertz google dont paracetamol dont worry go
ham,well right im gon na get check todays steam salespee text want come get,well right im gon na get check todays steam salespee text want come get
ham,arrived see couple days lt3,arrived see couple days lt
ham,k wat tht incident,k wat tht incident
ham,yeah get unlimited,yeah get unlimited
ham,cthen thk shd b enuff still got conclusion n contents pg n references ill b da contents pg n cover pg,cthen thk shd b enuff still got conclusion n contents pg n references ill b da contents pg n cover pg
ham,forgot takes 3 years shower sorry atyour phone dead yet,forgot takes years shower sorry atyour phone dead yet
ham,ü got wat buy tell us ü need come,got wat buy tell us need come
ham,big god bring success,big god bring success
spam,uve bin awarded 50 play 4 instant cash call 08715203028 claim every 9th player wins min 50500 optout 08718727870,uve bin awarded play instant cash call claim every th player wins min optout
ham,r stayin extra week back next wed rugby weekend hi c u soon,r stayin extra week back next wed rugby weekend hi c u soon
ham,well theres still bit left guys want tonight,well theres still bit left guys want tonight
ham,campus library,campus library
ham,affidavit says ltgt e twiggs st division g courtroom ltgt lttimegt ill double check text tomorrow,affidavit says ltgt e twiggs st division g courtroom ltgt lttimegt ill double check text tomorrow
ham,creep _,creep
ham,tell friends plan valentines day lturlgt,tell friends plan valentines day lturlgt
ham,get ten billion calls texts help god,get ten billion calls texts help god
ham,purity friendship two smiling reading forwarded messageits smiling seeing name gud evng musthu,purity friendship two smiling reading forwarded messageits smiling seeing name gud evng musthu
ham,ive told ive returned order,ive told ive returned order
ham,housemaid murderer coz man murdered ltgt th january public holiday govtinstituitions closedincluding post office,housemaid murderer coz man murdered ltgt th january public holiday govtinstituitions closedincluding post office
ham,depends u going lor,depends u going lor
ham,smile right go world wonder smiling think crazy keep away grins,smile right go world wonder smiling think crazy keep away grins
spam,freemsgfav xmas tonesreply real,freemsgfav xmas tonesreply real
ham,lil fever fine,lil fever fine
ham,think still car,think still car
ham,,
spam,december mobile 11mths entitled update latest colour camera mobile free call mobile update co free 08002986906,december mobile mths entitled update latest colour camera mobile free call mobile update co free
ham,yes princess want catch big strong hands,yes princess want catch big strong hands
ham,oh yeah forgot u take 2 shopping,oh yeah forgot u take shopping
ham,mm asked call radio,mm asked call radio
ham,thinkin someone good drugs,thinkin someone good drugs
ham,say slowly godi love amp need youclean heart bloodsend ten special people amp u c miracle tomorrow itplspls,say slowly godi love amp need youclean heart bloodsend ten special people amp u c miracle tomorrow itplspls
ham,enjoy showers possessiveness poured u ur loved ones bcoz world lies golden gift loved truly,enjoy showers possessiveness poured u ur loved ones bcoz world lies golden gift loved truly
ham,alright youre sure let know youre leaving,alright youre sure let know youre leaving
ham,lasting much 2 hours might get lucky,lasting much hours might get lucky
ham,genius whats brother pls send number skype,genius whats brother pls send number skype
spam,gr8 poly tones 4 mobs direct 2u rply poly title 8007 eg poly breathe1 titles crazyin sleepingwith finest ymca getzedcouk pobox365o4w45wq 300p,gr poly tones mobs direct u rply poly title eg poly breathe titles crazyin sleepingwith finest ymca getzedcouk poboxowwq p
ham,thk em find wtc far weiyi goin e rest dunno yet r ur goin 4 dinner den might b able join,thk em find wtc far weiyi goin e rest dunno yet r ur goin dinner den might b able join
ham,dont forget owns whos private property good boy always passionate kiss,dont forget owns whos private property good boy always passionate kiss
spam,interflora late order interflora flowers christmas call 0800 505060 place order midnight tomorrow,interflora late order interflora flowers christmas call place order midnight tomorrow
ham,oh godtaken teethis paining,oh godtaken teethis paining
spam,romcapspam everyone around responding well presence since warm outgoing bringing real breath sunshine,romcapspam everyone around responding well presence since warm outgoing bringing real breath sunshine
ham,u ask darren go n pick u lor oso sian tmr haf 2 meet lect,u ask darren go n pick u lor oso sian tmr haf meet lect
ham,need buy lunch eat maggi mee,need buy lunch eat maggi mee
spam,congratulations thanks good friend u 2000 xmas prize 2 claim easy call 08712103738 10p per minute btnationalrate,congratulations thanks good friend u xmas prize claim easy call p per minute btnationalrate
ham,ok lor,ok lor
ham,oh right ok ill make sure loads work day got really nasty cough today dry n shot really help,oh right ok ill make sure loads work day got really nasty cough today dry n shot really help
ham,wifehow knew time murder exactly,wifehow knew time murder exactly
spam,send logo 2 ur lover 2 names joined heart txt love name1 name2 mobno eg love adam eve 07123456789 87077 yahoo pobox36504w45wq txtno 4 ads 150p,send logo ur lover names joined heart txt love name name mobno eg love adam eve yahoo poboxwwq txtno ads p
ham,howz persons story,howz persons story
ham,thanx 4 sending home,thanx sending home
ham,normally hot mail com see,normally hot mail com see
spam,youve tkts euro2004 cup final 800 cash collect call 09058099801 b4190604 pobox 7876150ppm,youve tkts euro cup final cash collect call b pobox ppm
ham,u sick still go shopping,u sick still go shopping
ham,ya well fine bbdpooja full pimpleseven become quite blackand ur rite cold wearing sweatter,ya well fine bbdpooja full pimpleseven become quite blackand ur rite cold wearing sweatter
ham,nicenicehow working,nicenicehow working
ham,1s reach home call,reach home call
ham,trying find chinese food place around,trying find chinese food place around
ham,easy mate guess quick drink bit ambitious,easy mate guess quick drink bit ambitious
ham,babe miiiiiiissssssssss need crave geeee im sad without babe love,babe miiiiiiissssssssss need crave geeee im sad without babe love
ham,ok thanx,ok thanx
ham,aathiwhere dear,aathiwhere dear
ham,tunji hows queen wishing great day abiola,tunji hows queen wishing great day abiola
ham,today iz yellow rose day u love frndship give 1 misscall amp send ur frndz amp see many miss calls u get u get 6missed u marry ur lover,today iz yellow rose day u love frndship give misscall amp send ur frndz amp see many miss calls u get u get missed u marry ur lover
ham,class hours sorry,class hours sorry
ham,wat time u finish ur lect today,wat time u finish ur lect today
spam,freemessage jamsterget crazy frog sound poly text mad1 real text mad2 88888 6 crazy sounds 3 gbpweek 16only tcs apply,freemessage jamsterget crazy frog sound poly text mad real text mad crazy sounds gbpweek tcs apply
ham,sad story man last week bday wife didnt wish parents forgot n kids went work even colleagues wish entered cabin pa said happy bday boss felt special askd 4 lunch lunch invited apartment went said u mind go bedroom minute ok sed sexy mood came 5 minuts latr wid caken wife parents kidz friends n colleagues screaming surprise waiting sofa naked,sad story man last week bday wife didnt wish parents forgot n kids went work even colleagues wish entered cabin pa said happy bday boss felt special askd lunch lunch invited apartment went said u mind go bedroom minute ok sed sexy mood came minuts latr wid caken wife parents kidz friends n colleagues screaming surprise waiting sofa naked
spam,chance reality fantasy show call 08707509020 20p per min ntt ltd po box 1327 croydon cr9 5wb 0870 national rate call,chance reality fantasy show call p per min ntt ltd po box croydon cr wb national rate call
ham,shes fine good hear dear happy new year oh,shes fine good hear dear happy new year oh
ham,going wipro interview today,going wipro interview today
ham,tall princess,tall princess
ham,doubt could handle 5 times per night case,doubt could handle times per night case
ham,haha hope ü hear receipt sound gd luck,haha hope hear receipt sound gd luck
ham,gon na death im gon na leave note says robs fault avenge,gon na death im gon na leave note says robs fault avenge
ham,japanese proverb one u none itu must indian version one let none itleave finally kerala version one stop none make strike,japanese proverb one u none itu must indian version one let none itleave finally kerala version one stop none make strike
ham,today im workin free oso gee thgt u workin ur frens shop,today im workin free oso gee thgt u workin ur frens shop
ham,life face choices toss coin becoz settle question coin air u know heart hoping gudni8,life face choices toss coin becoz settle question coin air u know heart hoping gudni
ham,know god created gap fingers one made comes amp fills gaps holding hand love,know god created gap fingers one made comes amp fills gaps holding hand love
ham,want kiss feel next,want kiss feel next
ham,happy saying,happy saying
spam,adult 18 content video shortly,adult content video shortly
ham,ok would b lovely u r sure think wot u want drinkin dancin eatin cinema u wot,ok would b lovely u r sure think wot u want drinkin dancin eatin cinema u wot
ham,im saying havent explicitly told nora know someone im probably gon na bother,im saying havent explicitly told nora know someone im probably gon na bother
ham,says hi get ass back south tampa preferably kegger,says hi get ass back south tampa preferably kegger
ham,smith waste dai wan na gayle,smith waste dai wan na gayle
ham,mum ive sent many many messages since got want know actually getting enjoy rest day,mum ive sent many many messages since got want know actually getting enjoy rest day
ham,aight tomorrow around ltgt,aight tomorrow around ltgt
ham,housemaid murderer coz man murdered ltgt th january public holiday govtinstituitions closedincluding post officeunderstand,housemaid murderer coz man murdered ltgt th january public holiday govtinstituitions closedincluding post officeunderstand
spam,chance reality fantasy show call 08707509020 20p per min ntt ltd po box 1327 croydon cr9 5wb 0870 national rate call,chance reality fantasy show call p per min ntt ltd po box croydon cr wb national rate call
ham,actually first time went bed long spoke woke 7 night,actually first time went bed long spoke woke night
ham,see,see
ham,dont understand message,dont understand message
ham,crucify c told earlier,crucify c told earlier
ham,idk keep saying youre since moved keep butting heads freedom vs responsibility im tired much shit deal im barely keeping together gets added,idk keep saying youre since moved keep butting heads freedom vs responsibility im tired much shit deal im barely keeping together gets added
ham,fuck cedar key fuck come anyway tho,fuck cedar key fuck come anyway tho
ham,twenty past five said train durham already coz reserved seat,twenty past five said train durham already coz reserved seat
spam,hey boys want hot xxx pics sent direct 2 ur phone txt porn 69855 24hrs free 50p per day stop text stopbcm sf wc1n3xx,hey boys want hot xxx pics sent direct ur phone txt porn hrs free p per day stop text stopbcm sf wcnxx
ham,u still painting ur wall,u still painting ur wall
spam,last chance claim ur 150 worth discount vouchers today text shop 85023 savamob offers mobile cs savamob pobox84 m263uz 300 sub 16,last chance claim ur worth discount vouchers today text shop savamob offers mobile cs savamob pobox muz sub
ham,printer cool mean groovy wine groovying,printer cool mean groovy wine groovying
ham,hi harishs rent transfred ur acnt,hi harishs rent transfred ur acnt
ham,anything lor coming,anything lor coming
ham,cbe really good nowadayslot shop showroomscity shaping good,cbe really good nowadayslot shop showroomscity shaping good
ham,ü still attending da talks,still attending da talks
ham,probs hon u doinat mo,probs hon u doinat mo
ham,k ill take care,k ill take care
ham,take didnt phone callon friday assume wont year,take didnt phone callon friday assume wont year
ham,battery low babe,battery low babe
ham,shuhui bought rons present swatch watch,shuhui bought rons present swatch watch
ham,yeah theres quite bit left ill swing tomorrow get,yeah theres quite bit left ill swing tomorrow get
ham,babe said 2 hours almost 4 internet,babe said hours almost internet
ham,k ill sure get noon see whats,k ill sure get noon see whats
ham,kkyesterday cbe,kkyesterday cbe
ham,went ganesh dress shop,went ganesh dress shop
spam,pdate_now double mins 1000 txts orange tariffs latest motorola sonyericsson nokia bluetooth free call mobileupd8 08000839402 call2optoutyhl,pdatenow double mins txts orange tariffs latest motorola sonyericsson nokia bluetooth free call mobileupd calloptoutyhl
ham,ü collecting ur laptop going configure da settings izzit,collecting ur laptop going configure da settings izzit
ham,r home come within 5 min,r home come within min
ham,aight 8 latest probably closer 7 jay tyler two trips,aight latest probably closer jay tyler two trips
ham,come aftr ltdecimalgt cleaning house,come aftr ltdecimalgt cleaning house
spam,ur cashbalance currently 500 pounds maximize ur cashin send cash 86688 150pmsg cc 08718720201 po box 11414 tcrw1,ur cashbalance currently pounds maximize ur cashin send cash pmsg cc po box tcrw
ham,bill letters im expecting one orange isnt bill may still say orange,bill letters im expecting one orange isnt bill may still say orange
ham,tell pa pain de,tell pa pain de
ham,hi darlin hope nice night wish come cant wait see love fran ps want dirty anal sex want 10 man gang bang,hi darlin hope nice night wish come cant wait see love fran ps want dirty anal sex want man gang bang
ham,ha dont know either clever simple thing pears day perfect christmas,ha dont know either clever simple thing pears day perfect christmas
ham,helloooo wake sweet morning welcomes enjoy day full joy gud mrng,helloooo wake sweet morning welcomes enjoy day full joy gud mrng
ham,alrite,alrite
ham,must sit around wait summer days celebrate magical sight worlds dressed white oooooh let snow,must sit around wait summer days celebrate magical sight worlds dressed white oooooh let snow
spam,urgent mobile number awarded 2000 prize guaranteed call 09058094454 land line claim 3030 valid 12hrs,urgent mobile number awarded prize guaranteed call land line claim valid hrs
ham,guys go see movies side,guys go see movies side
ham,sorryin meeting ill call later,sorryin meeting ill call later
ham,didnt tell thatnow im thinking plus hes going stop runs,didnt tell thatnow im thinking plus hes going stop runs
ham,kindly send one flat ltdecimalgt today,kindly send one flat ltdecimalgt today
spam,sorry u unsubscribe yet mob offer package min term 54 weeks pls resubmit request expiry reply themob help 4 info,sorry u unsubscribe yet mob offer package min term weeks pls resubmit request expiry reply themob help info
ham,nothing lor bit bored dun u go home early 2 sleep today,nothing lor bit bored dun u go home early sleep today
ham,time tell friend around,time tell friend around
ham,yes fine love safe,yes fine love safe
ham,thanks chikku gud nyt,thanks chikku gud nyt
ham,xy ur car u picking,xy ur car u picking
ham,thanx 4 time weve spent 2geva bin mint ur baby want uxxxx,thanx time weve spent geva bin mint ur baby want uxxxx
ham,yo way could pick something tonight,yo way could pick something tonight
ham,ive sent send,ive sent send
ham,fine simply sitting,fine simply sitting
ham,thts gods gift birds humans hav natural gift frm god,thts gods gift birds humans hav natural gift frm god
ham,coming day class,coming day class
ham,im done studyn library,im done studyn library
ham,ok u enjoy ur shows,ok u enjoy ur shows
ham,anything,anything
ham,wuld without baby thought alone mite break dont wan na go crazy everyboy needs lady xxxxxxxx,wuld without baby thought alone mite break dont wan na go crazy everyboy needs lady xxxxxxxx
ham,wats dear sleeping ah,wats dear sleeping ah
ham,hi test ltgt rd,hi test ltgt rd
ham,2 students solved cat question xam 532 ltgt 924 ltgt 863 ltgt 725 tell answer u r brilliant1thingi got answr,students solved cat question xam ltgt ltgt ltgt tell answer u r brilliantthingi got answr
ham,yo know anyone ltgt otherwise able buy liquor guy flaked right dont get hold somebody 4 loko night,yo know anyone ltgt otherwise able buy liquor guy flaked right dont get hold somebody loko night
ham,yup n fren lor im meeting fren 730,yup n fren lor im meeting fren
ham,yeah got one lined us,yeah got one lined us
ham,stop wondering wow ever going stop tming tm whenever want mine laughs,stop wondering wow ever going stop tming tm whenever want mine laughs
ham,lol yep yesterday already got fireplace another icon sitting,lol yep yesterday already got fireplace another icon sitting
ham,hey ive booked pilates yoga lesson already haha,hey ive booked pilates yoga lesson already haha
ham,ok happen behave like,ok happen behave like
spam,1 new message please call 08712400200,new message please call
ham,supervisor find 4 one lor thk students havent ask yet tell u aft ask,supervisor find one lor thk students havent ask yet tell u aft ask
ham,hello news job making wait fifth week yeah im woozles weasels exeter still home 3,hello news job making wait fifth week yeah im woozles weasels exeter still home
ham,messageno responcewhat happend,messageno responcewhat happend
spam,currently message awaiting collection collect message call 08718723815,currently message awaiting collection collect message call
ham,hey babe sorry didnt get sooner gary come fix cause thinks knows doesnt go far ptbo says cost ltgt bucks dont know might cheaper find someone dont second hand machines right let know want babe,hey babe sorry didnt get sooner gary come fix cause thinks knows doesnt go far ptbo says cost ltgt bucks dont know might cheaper find someone dont second hand machines right let know want babe
ham,make 3 4 fucks sake x,make fucks sake x
ham,leave u always ignorant,leave u always ignorant
ham,nope ill b going 2 sch fri quite early lor cos mys sis got paper da morn,nope ill b going sch fri quite early lor cos mys sis got paper da morn
ham,bruce b downs amp fletcher,bruce b downs amp fletcher
ham,said would woke,said would woke
ham,hey free call,hey free call
ham,tell whos pls,tell whos pls
spam,urgent mobile awarded 1500 bonus caller prize 27603 final attempt 2 contact u call 08714714011,urgent mobile awarded bonus caller prize final attempt contact u call
ham,think might give miss teaching til twelve lecture two damn working thing,think might give miss teaching til twelve lecture two damn working thing
ham,id check theres like 1 bowls worth left,id check theres like bowls worth left
ham,yes many sweets,yes many sweets
ham,would im still cozy exhausted last nightnobody went school work everything closed,would im still cozy exhausted last nightnobody went school work everything closed
spam,u secret admirer reveal thinks u r special call 09065174042 opt reply reveal stop 150 per msg recd cust care 07821230901,u secret admirer reveal thinks u r special call opt reply reveal stop per msg recd cust care
ham,buzzzz grins buzz ass buzz chest buzz cock keep phone vibrator feel shake,buzzzz grins buzz ass buzz chest buzz cock keep phone vibrator feel shake
ham,sir send group mail check,sir send group mail check
ham,im da intro covers energy trends n pros n cons brief description nuclear fusion n oso brief history iter n jet got abt 7 n half pages,im da intro covers energy trends n pros n cons brief description nuclear fusion n oso brief history iter n jet got abt n half pages
ham,nonenowhere ikno doesdiscountshitinnit,nonenowhere ikno doesdiscountshitinnit
ham,dont know jabo abi,dont know jabo abi
spam,ever notice youre driving anyone going slower idiot everyone driving faster maniac,ever notice youre driving anyone going slower idiot everyone driving faster maniac
ham,yet hadya sapna aunty manege yday hogidhechinnu full weak swalpa black agidhane,yet hadya sapna aunty manege yday hogidhechinnu full weak swalpa black agidhane
ham,good baby,good baby
ham,neft transaction reference number ltgt rs ltdecimalgt credited beneficiary account ltgt lttimegt ltgt,neft transaction reference number ltgt rs ltdecimalgt credited beneficiary account ltgt lttimegt ltgt
ham,mostly sports typelyk footblcrckt,mostly sports typelyk footblcrckt
ham,head dey swell oh thanks making day,head dey swell oh thanks making day
ham,u make fb list,u make fb list
ham,height confidence aeronautics professors wer calld amp wer askd 2 sit aeroplane aftr sat wer told dat plane ws made students dey hurried plane bt 1 didnt move saidif made studentsthis wont even start datz confidence,height confidence aeronautics professors wer calld amp wer askd sit aeroplane aftr sat wer told dat plane ws made students dey hurried plane bt didnt move saidif made studentsthis wont even start datz confidence
ham,sary need tim bollox hurt lot tol,sary need tim bollox hurt lot tol
ham,happy new year princess,happy new year princess
ham,ill text carlos let know hang,ill text carlos let know hang
ham,dont worry easy ingredients,dont worry easy ingredients
ham,love u 2 little pocy bell sorry love u,love u little pocy bell sorry love u
ham,ok omw castor,ok omw castor
ham,yar lor keep raining non stop u wan 2 go elsewhere,yar lor keep raining non stop u wan go elsewhere
spam,xmas offer latest motorola sonyericsson nokia free bluetooth dvd double mins 1000 txt orange call mobileupd8 08000839402 call2optout4qf2,xmas offer latest motorola sonyericsson nokia free bluetooth dvd double mins txt orange call mobileupd calloptoutqf
ham,u mean u almost done done wif sleeping tot u going take nap yup send liao im picking ard 4 smth lor,u mean u almost done done wif sleeping tot u going take nap yup send liao im picking ard smth lor
ham,7 wonders world 7th 6th ur style 5th ur smile 4th ur personality 3rd ur nature 2nd ur sms 1st ur lovely friendship good morning dear,wonders world th th ur style th ur smile th ur personality rd ur nature nd ur sms st ur lovely friendship good morning dear
ham,tonight yeah id,tonight yeah id
ham,eat fo lunch senor,eat fo lunch senor
ham,said right giggle saw u would possibly first person2die nvq think much could,said right giggle saw u would possibly first persondie nvq think much could
ham,break time one come n get stuff fr ü,break time one come n get stuff fr
spam,reply win 100 weekly professional sport tiger woods play send stop 87239 end service,reply win weekly professional sport tiger woods play send stop end service
ham,im see cant see maybe reboot ym seen buzz,im see cant see maybe reboot ym seen buzz
ham,still grinder,still grinder
spam,1 polyphonic tone 4 ur mob every week txt pt2 87575 1st tone free get txtin tell ur friends 150ptone 16 reply hl 4info,polyphonic tone ur mob every week txt pt st tone free get txtin tell ur friends ptone reply hl info
ham,love isnt decision feeling could decide love life would much simpler less magical,love isnt decision feeling could decide love life would much simpler less magical
spam,hot live fantasies call 08707509020 20p per min ntt ltd po box 1327 croydon cr9 5wb 0870 national rate call,hot live fantasies call p per min ntt ltd po box croydon cr wb national rate call
ham,ki didt see youkwhere,ki didt see youkwhere
ham,im list buyers,im list buyers
ham,idea guess well work hour supposed leave since usual nobody interest figuring shit last second,idea guess well work hour supposed leave since usual nobody interest figuring shit last second
ham,mm entirely sure understood text hey ho weekend,mm entirely sure understood text hey ho weekend
