Category,Message,cleaned_email
ham,go jurong point crazy available bugis n great world la e buffet cine got amore wat,go jurong point crazy available bugis n great world la e buffet cine got amore wat
ham,ok lar joking wif u oni,ok lar joking wif u oni
spam,free entry 2 wkly comp win fa cup final tkts 21st may 2005 text fa 87121 receive entry questionstd txt ratetcs apply 08452810075over18s,free entry wkly comp win fa cup final tkts st may text fa receive entry questionstd txt ratetcs apply overs
ham,u dun say early hor u c already say,u dun say early hor u c already say
ham,nah dont think goes usf lives around though,nah dont think goes usf lives around though
spam,freemsg hey darling 3 weeks word back id like fun still tb ok xxx std chgs send 150 rcv,freemsg hey darling weeks word back id like fun still tb ok xxx std chgs send rcv
ham,even brother like speak treat like aids patent,even brother like speak treat like aids patent
ham,per request melle melle oru minnaminunginte nurungu vettam set callertune callers press 9 copy friends callertune,per request melle melle oru minnaminunginte nurungu vettam set callertune callers press copy friends callertune
spam,winner valued network customer selected receivea 900 prize reward claim call 09061701461 claim code kl341 valid 12 hours,winner valued network customer selected receivea prize reward claim call claim code kl valid hours
spam,mobile 11 months u r entitled update latest colour mobiles camera free call mobile update co free 08002986030,mobile months u r entitled update latest colour mobiles camera free call mobile update co free
ham,im gon na home soon dont want talk stuff anymore tonight k ive cried enough today,im gon na home soon dont want talk stuff anymore tonight k ive cried enough today
spam,six chances win cash 100 20000 pounds txt csh11 send 87575 cost 150pday 6days 16 tsandcs apply reply hl 4 info,six chances win cash pounds txt csh send cost pday days tsandcs apply reply hl info
spam,urgent 1 week free membership 100000 prize jackpot txt word claim 81010 tc wwwdbuknet lccltd pobox 4403ldnw1a7rw18,urgent week free membership prize jackpot txt word claim tc wwwdbuknet lccltd pobox ldnwarw
ham,ive searching right words thank breather promise wont take help granted fulfil promise wonderful blessing times,ive searching right words thank breather promise wont take help granted fulfil promise wonderful blessing times
ham,date sunday,date sunday
spam,xxxmobilemovieclub use credit click wap link next txt message click httpwap xxxmobilemovieclubcomnqjkgighjjgcbl,xxxmobilemovieclub use credit click wap link next txt message click httpwap xxxmobilemovieclubcomnqjkgighjjgcbl
ham,oh kim watching,oh kim watching
ham,eh u remember 2 spell name yes v naughty make v wet,eh u remember spell name yes v naughty make v wet
ham,fine thats way u feel thats way gota b,fine thats way u feel thats way gota b
spam,england v macedonia dont miss goalsteam news txt ur national team 87077 eg england 87077 trywales scotland 4txtú120 poboxox36504w45wq 16,england v macedonia dont miss goalsteam news txt ur national team eg england trywales scotland txt poboxoxwwq
ham,seriously spell name,seriously spell name
ham,im going try 2 months ha ha joking,im going try months ha ha joking
ham,ü pay first lar da stock comin,pay first lar da stock comin
ham,aft finish lunch go str lor ard 3 smth lor u finish ur lunch already,aft finish lunch go str lor ard smth lor u finish ur lunch already
ham,ffffffffff alright way meet sooner,ffffffffff alright way meet sooner
ham,forced eat slice im really hungry tho sucks mark getting worried knows im sick turn pizza lol,forced eat slice im really hungry tho sucks mark getting worried knows im sick turn pizza lol
ham,lol always convincing,lol always convincing
ham,catch bus frying egg make tea eating moms left dinner feel love,catch bus frying egg make tea eating moms left dinner feel love
ham,im back amp packing car ill let know theres room,im back amp packing car ill let know theres room
ham,ahhh work vaguely remember feel like lol,ahhh work vaguely remember feel like lol
ham,wait thats still clear sure sarcastic thats x doesnt want live us,wait thats still clear sure sarcastic thats x doesnt want live us
ham,yeah got 2 v apologetic n fallen actin like spoilt child got caught till 2 wont go badly cheers,yeah got v apologetic n fallen actin like spoilt child got caught till wont go badly cheers
ham,k tell anything,k tell anything
ham,fear fainting housework quick cuppa,fear fainting housework quick cuppa
spam,thanks subscription ringtone uk mobile charged 5month please confirm replying yes reply charged,thanks subscription ringtone uk mobile charged month please confirm replying yes reply charged
ham,yup ok go home look timings msg ü xuhui going learn 2nd may lesson 8am,yup ok go home look timings msg xuhui going learn nd may lesson
ham,oops ill let know roommates done,oops ill let know roommates done
ham,see letter b car,see letter b car
ham,anything lor u decide,anything lor u decide
ham,hello hows saturday go texting see youd decided anything tomo im trying invite anything,hello hows saturday go texting see youd decided anything tomo im trying invite anything
ham,pls go ahead watts wanted sure great weekend abiola,pls go ahead watts wanted sure great weekend abiola
ham,forget tell want need crave love sweet arabian steed mmmmmm yummy,forget tell want need crave love sweet arabian steed mmmmmm yummy
spam,07732584351 rodger burns msg tried call reply sms free nokia mobile free camcorder please call 08000930705 delivery tomorrow,rodger burns msg tried call reply sms free nokia mobile free camcorder please call delivery tomorrow
ham,seeing,seeing
ham,great hope like man well endowed ltgt inches,great hope like man well endowed ltgt inches
ham,callsmessagesmissed calls,callsmessagesmissed calls
ham,didnt get hep b immunisation nigeria,didnt get hep b immunisation nigeria
ham,fair enough anything going,fair enough anything going
ham,yeah hopefully tyler cant could maybe ask around bit,yeah hopefully tyler cant could maybe ask around bit
ham,u dont know stubborn didnt even want go hospital kept telling mark im weak sucker hospitals weak suckers,u dont know stubborn didnt even want go hospital kept telling mark im weak sucker hospitals weak suckers
ham,thinked first time saw class,thinked first time saw class
ham,gram usually runs like ltgt half eighth smarter though gets almost whole second gram ltgt,gram usually runs like ltgt half eighth smarter though gets almost whole second gram ltgt
ham,k fyi x ride early tomorrow morning hes crashing place tonight,k fyi x ride early tomorrow morning hes crashing place tonight
ham,wow never realized embarassed accomodations thought liked since best could always seemed happy cave im sorry didnt dont give im sorry offered im sorry room embarassing,wow never realized embarassed accomodations thought liked since best could always seemed happy cave im sorry didnt dont give im sorry offered im sorry room embarassing
spam,sms ac sptv new jersey devils detroit red wings play ice hockey correct incorrect end reply end sptv,sms ac sptv new jersey devils detroit red wings play ice hockey correct incorrect end reply end sptv
ham,know mallika sherawat yesterday find lturlgt,know mallika sherawat yesterday find lturlgt
spam,congrats 1 year special cinema pass 2 call 09061209465 c suprman v matrix3 starwars3 etc 4 free bx420ip45we 150pm dont miss,congrats year special cinema pass call c suprman v matrix starwars etc free bxipwe pm dont miss
ham,sorry ill call later meeting,sorry ill call later meeting
ham,tell reached,tell reached
ham,yesgauti sehwag odi series,yesgauti sehwag odi series
ham,gon na pick 1 burger way home cant even move pain killing,gon na pick burger way home cant even move pain killing
ham,ha ha ha good joke girls situation seekers,ha ha ha good joke girls situation seekers
ham,part checking iq,part checking iq
ham,sorry roommates took forever ok come,sorry roommates took forever ok come
ham,ok lar double check wif da hair dresser already said wun cut v short said cut look nice,ok lar double check wif da hair dresser already said wun cut v short said cut look nice
spam,valued customer pleased advise following recent review mob awarded 1500 bonus prize call 09066364589,valued customer pleased advise following recent review mob awarded bonus prize call
ham,today song dedicated day song u dedicate send ur valuable frnds first rply,today song dedicated day song u dedicate send ur valuable frnds first rply
spam,urgent ur awarded complimentary trip eurodisinc trav acoentry41 1000 claim txt dis 87121 186150morefrmmob shracomorsglsuplt10 ls1 3aj,urgent ur awarded complimentary trip eurodisinc trav acoentry claim txt dis morefrmmob shracomorsglsuplt ls aj
spam,hear new divorce barbie comes kens stuff,hear new divorce barbie comes kens stuff
ham,plane give month end,plane give month end
ham,wah lucky man save money hee,wah lucky man save money hee
ham,finished class,finished class
ham,hi babe im home wan na something xx,hi babe im home wan na something xx
ham,kkwhere youhow performed,kkwhere youhow performed
ham,u call,u call
ham,waiting machan call free,waiting machan call free
ham,thats cool gentleman treat dignity respect,thats cool gentleman treat dignity respect
ham,like peoples much shy pa,like peoples much shy pa
ham,operate ltgt,operate ltgt
ham,still looking job much tas earn,still looking job much tas earn
ham,sorry ill call later,sorry ill call later
ham,k call ah,k call ah
ham,ok way home hi hi,ok way home hi hi
ham,place man,place man
ham,yup next stop,yup next stop
ham,call later dont network urgnt sms,call later dont network urgnt sms
ham,real u getting yo need 2 tickets one jacket im done already used multis,real u getting yo need tickets one jacket im done already used multis
ham,yes started send requests make pain came back im back bed double coins factory got ta cash nitros,yes started send requests make pain came back im back bed double coins factory got ta cash nitros
ham,im really still tonight babe,im really still tonight babe
ham,ela kanoil download come wen ur free,ela kanoil download come wen ur free
ham,yeah dont stand close tho youll catch something,yeah dont stand close tho youll catch something
ham,sorry pain ok meet another night spent late afternoon casualty means havent done stuff42moro includes time sheets sorry,sorry pain ok meet another night spent late afternoon casualty means havent done stuffmoro includes time sheets sorry
ham,smile pleasure smile pain smile trouble pours like rain smile sum1 hurts u smile becoz someone still loves see u smiling,smile pleasure smile pain smile trouble pours like rain smile sum hurts u smile becoz someone still loves see u smiling
spam,please call customer service representative 0800 169 6031 10am9pm guaranteed 1000 cash 5000 prize,please call customer service representative ampm guaranteed cash prize
ham,havent planning buy later check already lido got 530 show e afternoon u finish work already,havent planning buy later check already lido got show e afternoon u finish work already
spam,free ringtone waiting collected simply text password mix 85069 verify get usher britney fml po box 5249 mk17 92h 450ppw 16,free ringtone waiting collected simply text password mix verify get usher britney fml po box mk h ppw
ham,watching telugu moviewat abt u,watching telugu moviewat abt u
ham,see finish loads loans pay,see finish loads loans pay
ham,hi wk ok hols yes bit run forgot hairdressers appointment four need get home n shower beforehand cause prob u,hi wk ok hols yes bit run forgot hairdressers appointment four need get home n shower beforehand cause prob u
ham,see cup coffee animation,see cup coffee animation
ham,please dont text anymore nothing else say,please dont text anymore nothing else say
ham,okay name ur price long legal wen pick u ave x ams xx,okay name ur price long legal wen pick u ave x ams xx
ham,im still looking car buy gone 4the driving test yet,im still looking car buy gone driving test yet
ham,per request melle melle oru minnaminunginte nurungu vettam set callertune callers press 9 copy friends callertune,per request melle melle oru minnaminunginte nurungu vettam set callertune callers press copy friends callertune
ham,wow youre right didnt mean guess gave boston men changed search location nyc something changed cuz signin page still says boston,wow youre right didnt mean guess gave boston men changed search location nyc something changed cuz signin page still says boston
ham,umma life vava umma love lot dear,umma life vava umma love lot dear
ham,thanks lot wishes birthday thanks making birthday truly memorable,thanks lot wishes birthday thanks making birthday truly memorable
ham,aight ill hit get cash,aight ill hit get cash
ham,would ip address test considering computer isnt minecraft server,would ip address test considering computer isnt minecraft server
ham,know grumpy old people mom like better lying always one play jokes,know grumpy old people mom like better lying always one play jokes
ham,dont worry guess hes busy,dont worry guess hes busy
ham,plural noun research,plural noun research
ham,going dinnermsg,going dinnermsg
ham,im ok wif cos like 2 try new things scared u dun like mah cos u said loud,im ok wif cos like try new things scared u dun like mah cos u said loud
spam,gent trying contact last weekends draw shows 1000 prize guaranteed call 09064012160 claim code k52 valid 12hrs 150ppm,gent trying contact last weekends draw shows prize guaranteed call claim code k valid hrs ppm
ham,wa ur openin sentence formal anyway im fine juz tt im eatin much n puttin weighthaha anythin special happened,wa ur openin sentence formal anyway im fine juz tt im eatin much n puttin weighthaha anythin special happened
ham,entered cabin pa said happy bday boss felt special askd 4 lunch lunch invited apartment went,entered cabin pa said happy bday boss felt special askd lunch lunch invited apartment went
spam,winner u specially selected 2 receive 1000 4 holiday flights inc speak live operator 2 claim 0871277810910pmin 18,winner u specially selected receive holiday flights inc speak live operator claim pmin
ham,goodo yes must speak friday eggpotato ratio tortilla needed,goodo yes must speak friday eggpotato ratio tortilla needed
ham,hmmmy uncle informed hes paying school directly pls buy food,hmmmy uncle informed hes paying school directly pls buy food
spam,private 2004 account statement 07742676969 shows 786 unredeemed bonus points claim call 08719180248 identifier code 45239 expires,private account statement shows unredeemed bonus points claim call identifier code expires
spam,urgent mobile awarded 2000 bonus caller prize 5903 final try contact u call landline 09064019788 box42wr29c 150ppm,urgent mobile awarded bonus caller prize final try contact u call landline boxwrc ppm
ham,new address applespairsall malarky,new address applespairsall malarky
spam,todays voda numbers ending 7548 selected receive 350 award match please call 08712300220 quoting claim code 4041 standard rates app,todays voda numbers ending selected receive award match please call quoting claim code standard rates app
ham,going sao mu today done 12,going sao mu today done
ham,ü predict wat time üll finish buying,predict wat time finish buying
ham,good stuff,good stuff
ham,knowyetunde hasnt sent money yet sent text bother sending dont involve anything shouldnt imposed anything first place apologise,knowyetunde hasnt sent money yet sent text bother sending dont involve anything shouldnt imposed anything first place apologise
ham,room,room
ham,hey girl r u hope u r well del r bak long time c give call sum time lucyxx,hey girl r u hope u r well del r bak long time c give call sum time lucyxx
ham,kkhow much cost,kkhow much cost
ham,im home,im home
ham,dear call tmorrowpls accomodate,dear call tmorrowpls accomodate
ham,first answer question,first answer question
spam,sunshine quiz wkly q win top sony dvd player u know country algarve txt ansr 82277 150 sptyrone,sunshine quiz wkly q win top sony dvd player u know country algarve txt ansr sptyrone
spam,want 2 get laid tonight want real dogging locations sent direct 2 ur mob join uks largest dogging network bt txting gravel 69888 nt ec2a 31pmsg150p,want get laid tonight want real dogging locations sent direct ur mob join uks largest dogging network bt txting gravel nt eca pmsgp
ham,haf msn yijuehotmailcom,haf msn yijuehotmailcom
ham,call meet,call meet
ham,check rooms befor activities,check rooms befor activities
spam,youll rcv msgs chat svc free hardcore services text go 69988 u get nothing u must age verify yr network try,youll rcv msgs chat svc free hardcore services text go u get nothing u must age verify yr network try
ham,got c lazy type forgot ü lect saw pouch like v nice,got c lazy type forgot lect saw pouch like v nice
ham,k text youre way,k text youre way
ham,sir waiting mail,sir waiting mail
ham,swt thought nver get tired little things 4 lovable persons cozsomtimes little things occupy biggest part hearts gud ni8,swt thought nver get tired little things lovable persons cozsomtimes little things occupy biggest part hearts gud ni
ham,know pls open back,know pls open back
ham,yes see ya dot,yes see ya dot
ham,whats staff name taking class us,whats staff name taking class us
spam,freemsg havent replied text im randy sexy female live local luv hear u netcollex ltd 08700621170150p per msg reply stop end,freemsg havent replied text im randy sexy female live local luv hear u netcollex ltd p per msg reply stop end
ham,ummmawill call check inour life begin qatar pls pray hard,ummmawill call check inour life begin qatar pls pray hard
ham,ki deleted contact,ki deleted contact
ham,sindu got job birla soft,sindu got job birla soft
ham,wine flowing im nevering,wine flowing im nevering
ham,yup thk cine better cos need 2 go 2 plaza mah,yup thk cine better cos need go plaza mah
ham,ok ur typical reply,ok ur typical reply
ham,per request melle melle oru minnaminunginte nurungu vettam set callertune callers press 9 copy friends callertune,per request melle melle oru minnaminunginte nurungu vettam set callertune callers press copy friends callertune
ham,everywhere dirt floor windows even shirt sometimes open mouth comes flowing dream world without half chores time joy lots tv shows ill see guess like things must exist like rain hail mist time done become one,everywhere dirt floor windows even shirt sometimes open mouth comes flowing dream world without half chores time joy lots tv shows ill see guess like things must exist like rain hail mist time done become one
ham,aaooooright work,aaooooright work
ham,im leaving house,im leaving house
ham,hello love get interview today happy good boy think meare missing,hello love get interview today happy good boy think meare missing
spam,customer service annoncement new years delivery waiting please call 07046744435 arrange delivery,customer service annoncement new years delivery waiting please call arrange delivery
spam,winner u specially selected 2 receive 1000 cash 4 holiday flights inc speak live operator 2 claim 0871277810810,winner u specially selected receive cash holiday flights inc speak live operator claim
ham,keep safe need miss already envy everyone sees real life,keep safe need miss already envy everyone sees real life
ham,new car house parentsi new job hand,new car house parentsi new job hand
ham,im love im excited day spend make happy,im love im excited day spend make happy
spam,pls stop bootydelious 32f inviting friend reply yes434 no434 see wwwsmsacubootydelious stop send stop frnd 62468,pls stop bootydelious f inviting friend reply yes see wwwsmsacubootydelious stop send stop frnd
spam,bangbabes ur order way u receive service msg 2 download ur content u goto wap bangb tv ur mobile internetservice menu,bangbabes ur order way u receive service msg download ur content u goto wap bangb tv ur mobile internetservice menu
ham,place ur points e cultures module already,place ur points e cultures module already
spam,urgent trying contact last weekends draw shows 900 prize guaranteed call 09061701939 claim code s89 valid 12hrs,urgent trying contact last weekends draw shows prize guaranteed call claim code valid hrs
ham,hi frnd best way avoid missunderstding wit beloved ones,hi frnd best way avoid missunderstding wit beloved ones
ham,great escape fancy bridge needs lager see tomo,great escape fancy bridge needs lager see tomo
ham,yes completely formclark also utter waste,yes completely formclark also utter waste
ham,sir need axis bank account bank address,sir need axis bank account bank address
ham,hmmm thk sure got time hop ard ya go 4 free abt muz call u discuss liao,hmmm thk sure got time hop ard ya go free abt muz call u discuss liao
ham,time coming later,time coming later
ham,bloody hell cant believe forgot surname mr ill give u clue spanish begins,bloody hell cant believe forgot surname mr ill give u clue spanish begins
ham,well im gon na finish bath goodfine night,well im gon na finish bath goodfine night
ham,let know youve got money carlos make call,let know youve got money carlos make call
ham,u still going mall,u still going mall
ham,turns friends staying whole show wont back til ltgt feel free go ahead smoke ltgt worth,turns friends staying whole show wont back til ltgt feel free go ahead smoke ltgt worth
ham,text doesnt reply let know log,text doesnt reply let know log
ham,hi spoke maneesha v wed like know satisfied experience reply toll free yes,hi spoke maneesha v wed like know satisfied experience reply toll free yes
ham,lifted hopes offer money need especially end month approaches hurts studying anyways gr8 weekend,lifted hopes offer money need especially end month approaches hurts studying anyways gr weekend
ham,lol u trust,lol u trust
ham,ok gentleman treat dignity respect,ok gentleman treat dignity respect
ham,guys close,guys close
ham,going nothing greatbye,going nothing greatbye
ham,hello handsome finding job lazy working towards getting back net mummy wheres boytoy miss,hello handsome finding job lazy working towards getting back net mummy wheres boytoy miss
ham,haha awesome minute,haha awesome minute
spam,please call customer service representative freephone 0808 145 4742 9am11pm guaranteed 1000 cash 5000 prize,please call customer service representative freephone ampm guaranteed cash prize
ham,got xmas radio times get,got xmas radio times get
ham,jus reached home go bathe first sis using net tell u finishes k,jus reached home go bathe first sis using net tell u finishes k
spam,unique enough find 30th august wwwareyouuniquecouk,unique enough find th august wwwareyouuniquecouk
ham,im sorry ive joined league people dont keep touch mean great deal friend times even great personal cost great week,im sorry ive joined league people dont keep touch mean great deal friend times even great personal cost great week
ham,hi finally completed course,hi finally completed course
ham,stop however suggest stays someone able give ors every stool,stop however suggest stays someone able give ors every stool
ham,hope youve settled new school year wishin gr8 day,hope youve settled new school year wishin gr day
ham,gud mrng dear hav nice day,gud mrng dear hav nice day
ham,u got persons story,u got persons story
ham,hamster dead hey tmr meet 1pm orchard mrt,hamster dead hey tmr meet pm orchard mrt
ham,hi kate evening hope see tomorrow bit bloody babyjontet txt back u xxx,hi kate evening hope see tomorrow bit bloody babyjontet txt back u xxx
ham,found enc ltgt,found enc ltgt
ham,sent ltgt bucks,sent ltgt bucks
ham,hello darlin ive finished college txt u finish u love kate xxx,hello darlin ive finished college txt u finish u love kate xxx
ham,account refilled successfully inr ltdecimalgt keralacircle prepaid account balance rs ltdecimalgt transaction id kr ltgt,account refilled successfully inr ltdecimalgt keralacircle prepaid account balance rs ltdecimalgt transaction id kr ltgt
ham,goodmorning sleeping ga,goodmorning sleeping ga
ham,u call alter 11 ok,u call alter ok
ham,ü say like dat dun buy ericsson oso oredi lar,say like dat dun buy ericsson oso oredi lar
ham,entered cabin pa said happy bday boss felt special askd 4 lunch lunch invited apartment went,entered cabin pa said happy bday boss felt special askd lunch lunch invited apartment went
ham,aight yo dats straight dogg,aight yo dats straight dogg
ham,please give us connection today ltdecimalgt refund bill,please give us connection today ltdecimalgt refund bill
ham,shoot big loads get ready,shoot big loads get ready
ham,whats bruv hope great break rewarding semester,whats bruv hope great break rewarding semester
ham,home always chat,home always chat
ham,kkgoodstudy well,kkgoodstudy well
ham,yup ü noe leh,yup noe leh
ham,sounds great home,sounds great home
ham,finally match heading towards draw prediction,finally match heading towards draw prediction
ham,tired havent slept well past nights,tired havent slept well past nights
ham,easy ahsen got selected means good,easy ahsen got selected means good
ham,take exam march 3,take exam march
ham,yeah think use gt atm register sure theres anyway help let know sure ready,yeah think use gt atm register sure theres anyway help let know sure ready
ham,ok prob take ur time,ok prob take ur time
ham,os called ubandu run without installing hard diskyou use os copy important files system give repair shop,os called ubandu run without installing hard diskyou use os copy important files system give repair shop
ham,sorry ill call later,sorry ill call later
ham,u say leh course nothing happen lar say v romantic jus bit lor thk e nite scenery nice leh,u say leh course nothing happen lar say v romantic jus bit lor thk e nite scenery nice leh
